{"aggregate_sha256":"7fd9465de1012687e9ad54f4ed66de4b8c32a460d36420d3bc4be1b3881fbecd","algorithm":"sha256-instrument-manifest-v1","exclude":["**/__pycache__/**","**/*.pyc"],"files":[{"path":"authorization-grant.schema.json","role":"schema","sha256":"7006edb926947409855160337ee960c419a33a5bd4591cb50b334883d4728ede","size":4836},{"path":"baseline-source.json","role":"source","sha256":"0bbcd65fe2f6819bebb1f94d3ec8678c7ddbb0a2c010d272abc894fa86a0aa19","size":19131},{"path":"blind-review-manifest.schema.json","role":"schema","sha256":"cc138ef60cc5d927e63742d55af846884594e8bb4d8c2424a29810892cdbbf7c","size":2844},{"path":"blind-review-result.schema.json","role":"schema","sha256":"76e8cd0f764fa5d0c66c2b9a8eac591e12ab80c62d33c90a312d9e9520ab2e4e","size":2391},{"path":"candidate-source.json","role":"source","sha256":"0b4d27d6a071ca1623d62b6d1786d7e77585db34306e80b13d8a833830b89609","size":22513},{"path":"cli-identities/codex-0.144.1-windows.json","role":"tool-profile","sha256":"066dfb2332989d4caad5d485c06337fdac4c636b71c27ae6a224574196886628","size":479},{"path":"cli-identity.schema.json","role":"schema","sha256":"f659d94fadaef819a3ee9115747cbf43a3d34d6dd2dbceff7d27faa9bd6a7e37","size":1903},{"path":"codex_exec_adapter.py","role":"adapter","sha256":"5be259e3539cb7dedfb3b534397d0a1354582d37eadb0fecc0f39eaf85800fc3","size":84752},{"path":"completion-claim.schema.json","role":"schema","sha256":"479004e45013d9698f0a818f64c870e0cf37f40d13f221a82a64995de9e86c64","size":658},{"path":"controller-interruption.schema.json","role":"schema","sha256":"adc12185019e9e5b5d7c7a873d939e7588f58d68ae041f3d396d20fe229d6c63","size":2982},{"path":"deterministic-authoritative-run.schema.json","role":"schema","sha256":"5a4f13288010220ed21c8d1e2edb9d33f5d7f3dc4fa48c686a671c014b99b726","size":2352},{"path":"deterministic-case-result.schema.json","role":"schema","sha256":"9be90dfb2101acfc6b0ebbcb617ac0bf7740afbf461a1e10f7e5c08bf463fb94","size":1365},{"path":"deterministic-fixture-catalog.json","role":"fixture","sha256":"bb7837cccbbd7a1f1324bce1736cdfaa66e938d0554f2c5e366968d2e3ca7e0d","size":993},{"path":"deterministic-fixture-catalog.schema.json","role":"schema","sha256":"ded9ba45dc0e5abed967e613df3bbd80f5497fd86901ce20b8fe9428a201afd0","size":1942},{"path":"deterministic-suite-result.schema.json","role":"schema","sha256":"ce30f183ad12d2a309dc642ae48f130e9466c6ec91a1f99344da9ff687b418a7","size":1775},{"path":"deterministic_runner.py","role":"evaluation","sha256":"744045dfdc9c7ddc8eca1f54953e46fd7f7045b2cd3b315686340ce3a7db4af9","size":31799},{"path":"evaluation-input-manifest.schema.json","role":"schema","sha256":"4a8600c27749cbfdb0c1be6b99a7a03d96817eb017aa001c7876bff4b683fc6d","size":4892},{"path":"evaluation-spec.json","role":"evaluation","sha256":"fd8edc79a216e777a186aadfcb468d8a9cbed18c613a8541d8b4908df518ebb7","size":4597},{"path":"evaluation-spec.schema.json","role":"schema","sha256":"cab3ba1011f2ec6cadea7eb44882b3a69277f845ec67729491bb5e5c1e354c4b","size":1711},{"path":"evaluation.py","role":"evaluation","sha256":"c260ec42b93f977c3f070a236346390d97e524fb4003657ff32e4dd82e4cacfb","size":146714},{"path":"evidence-manifest.schema.json","role":"schema","sha256":"a6ee48c6db2fa6687d5fe38af594eef984fbfc498c191e50ebd7cb350493e364","size":2092},{"path":"execution-ledger-record.schema.json","role":"schema","sha256":"ddcd12eb08e37129298066c38e0e75176dad58407346b39a90b4a87562e77ef8","size":3070},{"path":"execution_guard.py","role":"enforcement","sha256":"263c40a1dda0015f329c475a7d1cbe7f5016c00a6ad2285bd883ec87d2902939","size":77841},{"path":"experiment_harness.py","role":"harness","sha256":"c03c3511716776fd275682deae2dda429ce8c21edec6d2467285c95af00f12c6","size":65543},{"path":"final-workspace-manifest.schema.json","role":"schema","sha256":"8813282eacc3aa4072f5571cdfc9d6bd0ffd763234d666700f56131e0fecf400","size":1475},{"path":"freeze_experiment.py","role":"harness","sha256":"fe74455303b4d6798e19de9c646272a060d2d3b20a03b81b2856907f48766bd3","size":9723},{"path":"initial-workspace-manifest.schema.json","role":"schema","sha256":"4f0174b61acf94367ad7c0db63a04d0a928db2faec040437dc509ea5630a0d79","size":1526},{"path":"instrument-manifest.schema.json","role":"schema","sha256":"7987d9c68bc8eb89ad80842b98696d5c0bccc97e5f99ea5bbf192f591816ee39","size":1705},{"path":"interruption-evidence-manifest.schema.json","role":"schema","sha256":"8e38e360100d7b1b42338a587502047cb1e1e470efff2cfabf0ad95f759668bd","size":2272},{"path":"network-execution-boundary.schema.json","role":"schema","sha256":"c748b145f50110db88c35a40384009c5776462a62aa2600477609cad7e29275b","size":3699},{"path":"network_execution_boundary.py","role":"enforcement","sha256":"597c7d29afb29695390b21dbeac52d25f8dd9181f891a6d62215712c7edddaff","size":21355},{"path":"oracle-result.schema.json","role":"schema","sha256":"57d0dd444e0a38023c362501847c54edc6b015a34e7ccf7c753643d0e6977ce2","size":4537},{"path":"pilot-blind-review-manifest.schema.json","role":"schema","sha256":"f78a1bf67df99b2e0a9b0f8a7a671d4ce13117cda0a8923d48854a3f24a5c6f8","size":2924},{"path":"pilot-blind-review-result.schema.json","role":"schema","sha256":"12543fef7f242f81db63432ec9ec10b6b8a50fa8ad6dfd63e514e78a3c7a535e","size":2799},{"path":"pilot-calibration-result.schema.json","role":"schema","sha256":"627f7f1ccad3e2f8bc94d9c39492755f90bd94c6049bb969b365a634c524c195","size":3618},{"path":"pilot-campaign-evidence-manifest.schema.json","role":"schema","sha256":"ac14e253de37e4d09b5ba05b03bda060c7677c7fbd6cd36507a020edb241a94b","size":1677},{"path":"pilot-decoded-reviews.schema.json","role":"schema","sha256":"bf250f9d0e909747683ee3feaebc673511b532370d0e7c0d2d763e6a7f21a27d","size":2224},{"path":"pilot-evaluation-input-manifest.schema.json","role":"schema","sha256":"1562f820d895e02eaaeb977480d9ee2a0006582f2a72103cca435beadeb303e0","size":5160},{"path":"pilot-evaluator-manifest.json","role":"evaluation","sha256":"ad108aea1d596a18586f79b5c5c046909b79868daae25829b54623dfae64a815","size":7093},{"path":"pilot-evaluator-manifest.schema.json","role":"schema","sha256":"98b5ea53b31619a5d4ebc7b15ca168772d56e51193cb2691e71b108302c526bc","size":4145},{"path":"pilot-evaluator/S1/hidden_check.py","role":"evaluation","sha256":"d34d517116fd587d7a2eff0537e65e22a7e8d2e6b703b5e63821bd94e2be8930","size":240},{"path":"pilot-evaluator/T2/hidden_test.mjs","role":"evaluation","sha256":"393d2bf20739f3ccc8794886317a51484f751a2eb6baa56659e9f2b78f9edb1f","size":190},{"path":"pilot-evaluator/T3/injected/client-runtime.ts","role":"evaluation","sha256":"3fa864186a2bf2287184f795d6d80e049267adc7a97cbbf3d54cd7b7c5305b2f","size":173},{"path":"pilot-evaluator/T3/integration-failure.test.mjs","role":"evaluation","sha256":"2fad087765bfbfaea67aa3972354b72dd6508e0fe9cc37f6a2f655e1b1f6f3ab","size":279},{"path":"pilot-evaluator/T5/hidden_test.mjs","role":"evaluation","sha256":"8b6d87afeae3192a29ce527e8e9b23cf2a0292fd29c001d9af2adf170b501382","size":336},{"path":"pilot-evaluator/T5/injected/resume.ts","role":"evaluation","sha256":"9ffda83d433f3425989054183550a14cddfe57e0eaecac7da74d8da1dc719c09","size":113},{"path":"pilot-evaluator/T7/hidden_check.py","role":"evaluation","sha256":"f2248c9ba6643d60916a9c6fe28e19f792973ee52c9b847974e18f2b075d3727","size":10813},{"path":"pilot-final-freeze.schema.json","role":"schema","sha256":"9f8260aeb45cf64c366d1e18546d7f4243d7976d0c2cdde3e1ec55c4adc358ba","size":3641},{"path":"pilot-fixtures/CC0-1.0.txt","role":"fixture","sha256":"135d1aa894cd184a9f34ec21e271619c33f1896a21eea5b4ce1ba7b842506434","size":251},{"path":"pilot-fixtures/N0/README.md","role":"fixture","sha256":"8d969db9c5c3897c404af897679c827e3e7c8ecd7e1ba05037c3850069e25478","size":286},{"path":"pilot-fixtures/N0/fixture.json","role":"fixture","sha256":"99f7feef3361fb4bb523fa57aa2b980606653e9ceb56291c11e40a035452dbcc","size":2488},{"path":"pilot-fixtures/S1/fixture.json","role":"fixture","sha256":"2fdf4390e541694775595f8a4ca830bbab88babd2b52d3b52814dbd0ce1cb5cc","size":1640},{"path":"pilot-fixtures/T2/README.md","role":"fixture","sha256":"5bbfdc7bcc71f40447e37e7becbd0aafa9e620f076e484bc154278ac05cbbf10","size":213},{"path":"pilot-fixtures/T2/fixture.json","role":"fixture","sha256":"f8bf93c5bb97f6e10ad06f8488ec83777119ece5739f432298fe393864d6aeb5","size":2563},{"path":"pilot-fixtures/T3/README.md","role":"fixture","sha256":"541547ef8abc5ff827913476c5ebb7ae16ad3472a62201106d8b7b7dcf312852","size":274},{"path":"pilot-fixtures/T3/fixture.json","role":"fixture","sha256":"215086bb52f585389ce80bc989b9236cff290f6cd9536b376e6e91b8a7ada027","size":2704},{"path":"pilot-fixtures/T5/README.md","role":"fixture","sha256":"44fb3f9d1a7b65f3e06bd0d7d512e61502619b5d478d7f062ab344e9606b6078","size":269},{"path":"pilot-fixtures/T5/fixture.json","role":"fixture","sha256":"f0cb22829f8e89af4e84993dd6d801f72fe3c576d35ddc0ca000b129bc8be14a","size":3123},{"path":"pilot-fixtures/T7/fixture.json","role":"fixture","sha256":"87b37450bfd9ac6ef9efa2bcd90410493fc52f7de44f50d88e0ac194f062d67a","size":634},{"path":"pilot-oracle-judgment.schema.json","role":"schema","sha256":"24081f58de128e7bbb52309b2c1d0d1a4c37bb42ef4a2784b2709e149be47f65","size":2528},{"path":"pilot-oracle-observation.schema.json","role":"schema","sha256":"fe72a810faf11a605de10ec1467e7a8a4a3374e8437b10bd2120e9af2b03b426","size":4438},{"path":"pilot-oracle-result.schema.json","role":"schema","sha256":"407ac2e3e13eac3b7569bfd061d4f5ebcabb12e1ef6580bb765024654e9cf83e","size":3249},{"path":"pilot-pre-calibration-freeze.schema.json","role":"schema","sha256":"788531b597a2812a89a5ec30f13663636a3d5b8d307a7a90b4a1e780a0481654","size":2823},{"path":"pilot-preregistration.schema.json","role":"schema","sha256":"c02cbc6f3d6e83cc1b77bbe5d57aebf03d058de9430d00457a274608eaf81cc4","size":8317},{"path":"pilot-presented-artifact.schema.json","role":"schema","sha256":"12214be4ace4590958501f1039659cfedb3e0ce398a47cd9429171308f78e20f","size":1466},{"path":"pilot-report.schema.json","role":"schema","sha256":"e12f2ee73eb570b40934d5f72e3fd1c3274856043b9c0678bbf5b13a058b28f1","size